voice_04334_167_0LQ3y000009mRCcGAM,"Agent: [PERSON-1], this is [PERSON-2] from [NORP-1].
Agent: Have you been?
EndUser: I'm good, [PERSON-2].
Agent: Good to hear. No, I'm catching out of the blue here, but just reaching out on behalf of [NORP-1], the Integration on our sales force.
Agent: Is this a bad time?
EndUser: No, just to let you know, we do not have sales force at our organization. So, okay.
Agent: Okay.
Agent: Are you at teachers?
EndUser: Yeah.
Agent: Okay, I was just looking here and it looks like you guys did have it at least and maybe in Marketing cloud.
EndUser: Oh, you know what?
EndUser: Yeah, I know there is a sit. No, you're right. Yeah, there is a sales force.
Agent: Is it like a pretty niche part of the company?
EndUser: Yeah, yeah. Yeah, it's in our member services area. Yeah, yeah.
Agent: Okay, yeah.
EndUser: I think it monitors the the member, like the pension plan members when they come into the website, if I'm not mistaken, I don't know. But you're right. Yeah, I'm mistaken we do have [ORG-1]. So, yeah.
Agent: Yeah, no worries. I mean, like I'm reaching out.
EndUser: Yeah. Yeah.
Agent: We're actually like agnostic to [ORG-1] anyways. I saw that you guys had an install of [ORG-1]. So that's why I wanted to make note of that, of course.
EndUser: Okay. Yeah.
Agent: But yeah, so actually, I'm reaching out. I saw some folks on the team were downloading some of our resources and in the Integration space was just curious on your guys's current Integration strategy.
EndUser: It depends on where, what area you're talking about. So, you know, I must say, I think like I don't really have any needs right now. We're not a huge organization.
EndUser: You know, we have a few vendors that we have dealt with in the past. So, I don't have any sort of requirements or needs at this time that I need to fill. Okay.
Agent: Yeah, of course. That's actually why I'm calling.
EndUser: Yeah.
Agent: Typically, the folks that I talk to don't necessarily have that need right now. But we've had some conversations even with some folks over at rates.ca, which I know you guys acquired [DATE-1].
Agent: And know that some integrations can cost quite a bit of money and also take some time for you guys' dev teams. And more of just wanted to provide an overview of some of the success we've seen at companies.
Agent: Similar to teachers in the financial space.
EndUser: Okay, well, I mean, if you want to send me some info, I'd be happy to take a look at it. Okay.
Agent: Yeah, sounds great. Just want to confirm an email for you.
EndUser: Yeah.
Agent: Is that [PERSON-1] underscore ord at OTPP.com.
EndUser: Yeah, it is. Yeah.
Agent: Sounds great. Well, I can send that over, but know that those resources can be a little dense. So would love to talk some time on the calendar to go over some of those resources in the future.
Agent: Not asking for any time. [DATE-2]. [DATE-3] for us here, but more of like mid fed. If that works for you, I can send over a place.
EndUser: Well, let me take a look at the info.
Agent: Please.
EndUser: And I don't really want to be rude here. I don't mean to be rude, but I get a lot of calls.
Agent: Yes.
EndUser: I get a lot of calls from tech companies, from consulting companies. And so, and I'm a busy guy. So another reason I don't want to pretend to meet with you, but I got to pick and choose.
EndUser: So why don't you send me the info?
Agent: Yeah.
EndUser: And if there's something that's intriguing, I'll ping you back. Okay.
Agent: Yeah, sounds great. I mean, everyone's always asking you for time for sure, and you don't have an infinite amount of that.
EndUser: Yeah.
Agent: So yeah, I'll send over those resources, and I appreciate your honesty.
EndUser: Okay. All right.
Agent: All right, you have [DATE-4], [PERSON-1].
EndUser: Yeah, you too. Bye bye.",Where were some opportunities where the sales rep could have done a better job articulating the value proposition of our company or product?,"In the transcript, there are a few instances where the sales representative could have improved upon articulating the value proposition of their company or product:

1. At the beginning of the call, the sales representative mentions that they are from [NORP-1] and that they specialize in Integration on sales force. However, the customer clarifies that they do not have sales force in their organization. The sales representative could have done a better job of explaining their company's capabilities in a more general sense, rather than tying it to a specific product that the customer does not have.
2. The sales representative also mentions that they are agnostic to [ORG-1], which the customer has installed. While this is a good opportunity to highlight the flexibility of their product, the sales representative could have also emphasized how their product can complement or enhance the functionality of [ORG-1].
3. The sales representative mentions that they have had conversations with some folks over at rates.ca, which the customer has acquired. However, they do not elaborate on what those conversations entailed or how their product could benefit rates.ca.
4. The sales representative could have also done a better job of addressing the customer's concerns about the density of their resources and the time commitment required to review them. Instead of simply sending over the resources and waiting for the customer to reach out, the sales representative could have offered to schedule a follow-up call to walk the customer through the resources and answer any questions they may have.

Overall, the sales representative could have done a better job of tailoring their value proposition to the customer's specific needs and concerns, rather than relying solely on general statements about their company's capabilities.",Did the sales rep ask open-ended questions to identify customer intent? What were they?,"The sales rep did ask open-ended questions to identify customer intent. Specifically, they asked the following questions:

1. ""I was just curious on your guys's current Integration strategy.""
2. ""If there's something that's intriguing, I'll ping you back.""

These questions were asked to understand the customer's current approach to integration and to gauge their interest in the seller's product.",Identify opportunities where the sales rep could have spent more time understanding the customers needs.,"The sales representative could have spent more time understanding the customer's needs when they mentioned that their organization is not huge and they don't have any current requirements or needs at this time. The sales representative could have asked more specific questions to uncover any potential pain points or challenges the customer's organization is facing, even if they don't currently have a specific need for the seller's product.

Additionally, the sales representative could have asked about the vendors that the customer's organization has dealt with in the past to understand what solutions they have tried and why they were not a good fit. This information could have helped the sales representative tailor their approach and messaging to better address the customer's needs and concerns.

Finally, the sales representative could have asked about the customer's future plans or goals to identify any potential opportunities where the seller's product could add value in the future. By taking a more consultative approach and focusing on understanding the customer's needs, the sales representative could have built a stronger relationship with the customer and increased the likelihood of closing a deal in the future."
voice_04334_167_0LQ3y000009rnwXGAQ,"Agent: [PERSON-1] available?
EndUser: No, she's not on the work here anymore.
Agent: Oh, she no longer works for the company?
EndUser: No, sir, she doesn't.
Agent: Okay. Yeah, I was reaching out because I worked in the all three all sales force account team. And [PERSON-2] was one of our main points of contact previously.
Agent: Who was kind of the new point of contact?
EndUser: I'll point you in the direction I cannot give out any information within one of the whole of a second.
EndUser: Hello, [PERSON-3] speaking.
Agent: Hi [PERSON-4], this is [PERSON-5] with [ORG-1].
Agent: How are you doing [TIME-1]?
EndUser: Okay.
EndUser: How are you doing?
Agent: So I'm doing pretty good.
Agent: I was trying to get in contact with [PERSON-2], but I was told she's no longer with the company out and just kind of curious on who is going to be kind of taking over her role as one of the points of contact for us.
EndUser: Well, I guess, um, you know, it would be me.
EndUser: What company are you from?
Agent: [ORG-2]?
EndUser: Oh, [ORG-2]. Okay. Okay.
Agent: Yeah, and further...
EndUser: All right. I know that we are going to be renewing the contract.
Agent: Mm-hmm. Yeah, and part of the reason I was reaching out was we actually had a change in account teams for you all.
EndUser: Um, go on.
EndUser: Mm hmm.
Agent: We did like a reorganization [DATE-1].
Agent: And we were hoping to see if we couldn't pop get you guys on [TIME-2] discuss y'all's when you want to know it's coming And may and then also just introduce ourselves because we'll be y'all's point of contact moving forward Mm-hmm Right.
EndUser: So basically. What I do is I'm just an assistant. I, you know, create the purchase orders and all that. I think the person that you should be talking to would be our sales manager.
Agent: Okay.
EndUser: And his name is [PERSON-6]. [PERSON-7].
Agent: [PERSON-6], oh. Yeah, okay. Yeah. I reached out to him [DATE-2]. I just haven't heard back from him yet.
EndUser: Okay.
Agent: So we were reaching out to [PERSON-8] because we had heard this good.
EndUser: I'm sure he's extremely busy.
Agent: Yeah, I can imagine. But, but sweet. Yeah, I'll reach. I'll follow up with [PERSON-6] again.
EndUser: Yeah.
Agent: And then I appreciate all the help.
EndUser: Mm-hmm.
EndUser: No problem. And I believe our Contract is up in [DATE-3]. So I do think we have a little bit of time, but I know that he does want to move forward.
Agent: Correct. Yeah, and we try to. [PERSON-9].
Agent: Yeah, and we try to take just, you know, reach out a little earlier, just so, you know, if there was something you guys were looking at or change in the Contract where we're not scrambling at [TIME-3].
EndUser: Right.
Agent: But yeah, I'll follow up with him.
EndUser: Yeah.
Agent: And so you said, are you just kind of handling the invoice side now for [ORG-2]?
EndUser: Yeah.
Agent: Okay.
EndUser: Right.
Agent: Okay, I'll make sure to update our system because I think they still are sending out patty emails.
EndUser: Okay.
Agent: So I'll make sure that.
EndUser: You could just send to purchasing. I mean, I'm getting everything is only you're sending it to the purchasing email.
Agent: Okay.
Agent: I think it goes to both. I think she's just getting sent the same thing as well because she was listed as kind of the person handling the invoices.
EndUser: Okay. Yeah.
Agent: But if it's going, it should still be going to purchasing if that was set up previously.
EndUser: Yeah.
EndUser: Go to purchasing, right?
EndUser: And you can then remove her.
Agent: Yeah.
EndUser: Mm-hmm.
Agent: Okay, perfect. Well, I will mark that in our system.
EndUser: All right. Okay, [PERSON-10].
Agent: All right, no problem.
EndUser: Well, thank you for calling.
Agent: Have a great rest of the.
EndUser: You too. Bye.",Did the sales rep ask open-ended questions to identify customer intent? What were they?,"Answer: Yes, the sales rep asked open-ended questions to identify customer intent. Specifically, the sales rep asked the following open-ended questions:

1. ""Who is going to be kind of taking over her role as one of the points of contact for us?""
2. ""And then also just introduce ourselves because we'll be y'all's point of contact moving forward.""
3. ""So basically, what I do is I'm just an assistant. I, you know, create the purchase orders and all that. I think the person that you should be talking to would be our sales manager.""
4. ""So you said, are you just kind of handling the invoice side now for [ORG-2]?""

These questions were asked to understand the customer's current situation, identify the decision-maker, and clarify the customer's responsibilities in the purchasing process.","Overall, did the customer seem to feel that our product meets their needs?","Answer: The customer did not explicitly express their sentiment regarding whether the seller's product meets their needs. They did mention that the company would be renewing the contract, but it is unclear if this is in reference to the seller's product or another product.",Identify opportunities where the sales rep could have spent more time understanding the customers needs.,"The sales representative could have spent more time understanding the customer's needs when they discovered that the original point of contact, [PERSON-2], was no longer with the company and the new point of contact, [PERSON-3], mentioned that they were just an assistant handling invoices. The sales representative could have asked more questions to understand the decision-making process for renewing the contract and what changes, if any, the customer was looking to make in the new contract. Additionally, the sales representative could have asked about the customer's current experience with the seller's product and if there were any areas where the customer would like to see improvement.

Furthermore, the sales representative could have asked about the customer's sales manager [PERSON-6]'s priorities and goals for the upcoming contract renewal, and how the seller's product aligns with those priorities and goals. This would have helped the sales representative to better understand the customer's needs and position the seller's product as a solution to those needs.

In summary, the sales representative could have spent more time understanding the customer's needs by asking more questions about the decision-making process for the contract renewal, the customer's current experience with the seller's product, and the customer's sales manager's priorities and goals for the upcoming contract renewal.",What were the top 3 questions the sales rep asked where the customer seemed more engaged afterwards?,"1. ""Who is going to be kind of taking over her role as one of the points of contact for us?"" The customer, [PERSON-3], provided a clear answer to this question by identifying themselves as the new point of contact. The customer seemed engaged as they provided additional information about their role and suggested reaching out to the sales manager, [PERSON-6], for further discussions.

2. ""So basically, what I do is I'm just an assistant. I, you know, create the purchase orders and all that. I think the person that you should be talking to would be our sales manager."" This question prompted the customer to provide more context about their role and identify the sales manager as the appropriate person to speak with regarding the deal. The customer seemed engaged as they provided the sales manager's name and title.

3. ""And you said, are you just kind of handling the invoice side now for [ORG-2]?"" This question led to a discussion about the invoices and the purchasing process. The customer confirmed their role in handling invoices and provided clarification on where the invoices should be sent. The customer seemed engaged as they provided detailed information about the invoicing process and confirmed the correct email address for receiving invoices."
voice_04334_167_0LQ3y00000A63unGAB,"EndUser: If you know the extension number of the person you are trying to reach, please dial it now. For emergency support, dial 9. For the health desk, dial 1. Or dial 0 for the operator.
EndUser: [PERSON-1] por y amada dat apro. [PERSON-2]. Please stay on the line while your call is transferred to the operator.
EndUser: Good [TIME-1]. Thank you for calling data.
Agent: Hi there. [PERSON-3], please.
EndUser: With whom?
EndUser: Sorry.
Agent: [PERSON-3].
EndUser: [PERSON-3]. No, I'm sorry. I don't have any employed with that name working for the company.
Agent: Do you have [PERSON-4], ma'am.
EndUser: He's no longer employed by the company.
Agent: [PERSON-5]?
Agent: Would you be able to transfer me to somebody in sales by chance?
EndUser: What is the call regarding?
Agent: I'm calling from sales force. I'm one of the executives that's newly aligned to data pro ink.
EndUser: Give me one second
EndUser: Please. Hello.
Agent: Okay. Hi, I'm so sorry, I wasn't told who I was being transferred to who I got on the phone here.
EndUser: My name is [PERSON-6].
EndUser: Who is this?
Agent: Hey, [PERSON-6], this is [PERSON-7] from [ORG-1].
Agent: How are you?
EndUser: I'm good.
EndUser: How about you?
Agent: I I'm good too. Thank you for asking.
Agent: Why don't I give you a quick call?
Agent: So one of the executives that's newly aligned to data pro ink. I was just looking to set up [TIME-2] intro call sometime [DATE-1], if you had some time.
EndUser: Can do like [TIME-2] call [DATE-1].
Agent: Okay.
Agent: Um, what is your, are you, sorry, what is your last name?
Agent: Oh, okay, awesome.
Agent: And then is your email [EMAIL] or is there a better one?
EndUser: That's my personal. You guys should have my work email.
Agent: Okay.
EndUser: It's michael.zias at datafrommiami.com.
Agent: Okay.
Agent: Did a pro [ORG-2]. Okay, awesome. Cool.
Agent: And are you currently utilizing a [PRODUCT-1] right now?
EndUser: Yeah, we're on the source.
Agent: Oh, um.
EndUser: So, yeah, so we have a sister company called [ORG-3]. That's who our [ORG-1] organization is under.
Agent: Oh, okay. Oh, I'm sorry.
Agent: What's that company called?
EndUser: Global Outsource.
Agent: Well, okay. Cool. Sorry. I was unaware of that. So let me, yeah, I'll send you an email. But let me just, I'm gonna have to.
Agent: Ask a quick question, somebody on the account team over here just want to make sure
EndUser: Yeah, I mean, I had a meeting with one of your guys's reps [DATE-2], like [DATE-3].
Agent: Oh, did you?
Agent: Okay.
EndUser: Yeah.
Agent: Do you remember who that was?
EndUser: Give me [TIME-3].
Agent: Yeah, no worries.
EndUser: Oh, don't tell me. Yep, outlook is crashing.
Agent: So you guys are at [ORG-4], are also, you're using [ORG-1] just through global outsource.
EndUser: Yeah, it's our sister company. We're going to be merging them into a single company soon, I believe as well.
Agent: Okay.
Agent: No worries, if you can't find, I can probably find it too if I just do a little bit of deeper dive in here, find out who your point of contact was.
EndUser: [PERSON-8], I believe it's [PERSON-8] unless she's no longer with you guys.
Agent: [PERSON-9].
Agent: Okay. She's not on my team, but I'll look it up for sure. But sorry, I was on a word that you guys were current customers.
EndUser: No, it's okay. No worries. I get it.
Agent: Okay.
EndUser: It's a little confusing.
Agent: It is a little bit. But okay, sounds good.
EndUser: Yeah.
Agent: I'll figure out who you were chatting with too, and I can just make sure that there's like a bridge to the gap in there for you guys.
EndUser: Okay. Perfect. Thank you so much.
Agent: Okay. Yeah, no worries. Have a good one.
EndUser: You too. Bye.
Agent: Bye bye.",Identify opportunities where the sales rep could have spent more time understanding the customers needs.,"The sales representative could have spent more time understanding the customer's needs when they were discussing the customer's current usage of the seller's product. The customer mentioned that they are using the seller's product through their sister company, Global Outsource, and that they plan to merge into a single company soon. The sales representative could have asked more questions to understand the implications of this merger on the customer's use of the seller's product, such as whether the customer plans to continue using the seller's product after the merger, or if they anticipate any changes in their usage.

Additionally, the sales representative could have spent more time understanding the customer's needs by asking about the customer's previous meeting with the seller's representative. The customer mentioned that they had a meeting with a representative from the seller's company, but the sales representative did not ask any questions about what was discussed in that meeting or what the customer's takeaways were. This could have been an opportunity for the sales representative to understand the customer's pain points, goals, and priorities, and to tailor their pitch accordingly."
